{
  "$schema": "https://json-schema.org/draft/2020-12/schema",
  "$id": "https://github.com/AccesSOS/open-dispatch-simulator/schema/pack.schema.json",
  "title": "Protocol Pack",
  "description": "A jurisdiction's emergency call-intake playbook, expressed as a decision tree with per-locale string catalogs. Protocol logic is language-neutral; every caller-facing utterance is a stringId resolved against the catalog for the active locale.",
  "type": "object",
  "required": [
    "schemaVersion",
    "id",
    "name",
    "jurisdiction",
    "provenance",
    "locales",
    "defaultLocale",
    "caseEntry",
    "protocols",
    "fallbackProtocol",
    "strings"
  ],
  "additionalProperties": false,
  "properties": {
    "schemaVersion": { "enum": ["0.1", "0.2", "0.3", "0.4"] },
    "id": { "type": "string", "pattern": "^[a-z0-9][a-z0-9-]*$" },
    "name": { "$ref": "#/$defs/localizedText" },
    "jurisdiction": {
      "type": "object",
      "required": ["country", "emergencyNumber"],
      "additionalProperties": false,
      "properties": {
        "country": { "type": "string", "description": "ISO 3166-1 alpha-2", "pattern": "^[A-Z]{2}$" },
        "region": { "type": "string", "description": "State/province/agency scope, free-form" },
        "emergencyNumber": { "type": "string", "description": "e.g. 911" }
      }
    },
    "provenance": {
      "type": "object",
      "description": "Where this playbook's content came from and under what license it may be redistributed. Packs without redistribution rights must not be published in the public corpus.",
      "required": ["source", "license"],
      "additionalProperties": false,
      "properties": {
        "source": { "type": "string" },
        "url": { "type": "string" },
        "license": { "type": "string", "description": "SPDX id or 'public-domain'" },
        "digitizedDate": { "type": "string", "format": "date" },
        "notes": { "type": "string" }
      }
    },
    "locales": {
      "type": "array",
      "items": { "$ref": "#/$defs/locale" },
      "minItems": 1,
      "uniqueItems": true
    },
    "defaultLocale": { "$ref": "#/$defs/locale" },
    "caseEntry": {
      "type": "array",
      "description": "Universal intake questions asked on every call, in order, before a protocol is selected.",
      "items": { "$ref": "#/$defs/question" },
      "minItems": 1
    },
    "protocols": {
      "type": "array",
      "items": { "$ref": "#/$defs/protocol" },
      "minItems": 1
    },
    "fallbackProtocol": {
      "type": "string",
      "description": "Protocol id used when the chief complaint matches no protocol's keywords."
    },
    "lexicon": {
      "type": "object",
      "description": "v0.4: per-locale vocabulary the value extractors read — spoken numerals, time units, words for a newborn, street types. The engine ships tables for the locales the corpus speaks; this overrides or extends them, and is required for a locale the engine does not ship.",
      "additionalProperties": {
        "type": "object",
        "additionalProperties": false,
        "minProperties": 1,
        "properties": {
          "numbers": { "type": "object", "additionalProperties": { "type": "number" }, "minProperties": 1 },
          "ageUnits": { "type": "object", "additionalProperties": { "type": "number" }, "description": "Time-unit word to fraction of a year.", "minProperties": 1 },
          "ageTerms": { "type": "object", "additionalProperties": { "type": "number" }, "description": "Standalone age word to years.", "minProperties": 1 },
          "streetTypes": { "type": "array", "items": { "type": "string" }, "minItems": 1 },
          "unitTypes": { "type": "array", "items": { "type": "string" }, "minItems": 1 }
        }
      }
    },
    "scripts": {
      "type": "array",
      "description": "v0.3: interactive instruction scripts — the telephone procedures an EMD reads out and steers by the caller's answers (CPR, choking, childbirth, AED). Unlike postDispatch, a script may ask questions and branch. Scripts must form a DAG: no step may be reachable from itself, directly or through another script, so every run terminates.",
      "items": { "$ref": "#/$defs/instructionScript" }
    },
    "strings": {
      "type": "object",
      "description": "Per-locale catalogs: stringId -> template, or an array of equivalent template variants (a persona picks one, seeded). Templates may interpolate collected slots as {slotName}. The 'greeting', 'closing', 'dispatch_confirm', and 'clarify' ids are required by the engine.",
      "additionalProperties": {
        "type": "object",
        "additionalProperties": {
          "oneOf": [
            { "type": "string" },
            { "type": "array", "items": { "type": "string" }, "minItems": 1 }
          ]
        }
      }
    }
  },
  "$defs": {
    "locale": { "type": "string", "pattern": "^[a-z]{2}(-[A-Za-z0-9]+)?$" },
    "localizedText": {
      "type": "object",
      "additionalProperties": { "type": "string" },
      "minProperties": 1
    },
    "localizedKeywords": {
      "type": "object",
      "additionalProperties": {
        "type": "array",
        "items": { "type": "string" },
        "minItems": 1
      },
      "minProperties": 1
    },
    "question": {
      "type": "object",
      "required": ["id", "slot", "stringId"],
      "additionalProperties": false,
      "properties": {
        "id": { "type": "string" },
        "slot": { "type": "string", "pattern": "^[a-zA-Z][a-zA-Z0-9_]*$" },
        "stringId": { "type": "string" },
        "selectsProtocol": {
          "type": "boolean",
          "description": "This answer is matched against protocol keywords to choose the protocol."
        },
        "confirmStringId": {
          "type": "string",
          "description": "Optional read-back template (interpolating this question's slot) that a persona may speak after the answer, e.g. \"Okay, {address}.\""
        },
        "extract": {
          "enum": ["number", "age", "count", "address", "phone"],
          "description": "Pull a value out of the caller's answer instead of storing the whole sentence, so a read-back can confirm what was recorded and a condition can test it. v0.2: \"number\" — the first number in the answer, enabling numeric determinant/edge conditions (e.g. age > 35). v0.4: \"age\" is unit-aware (\"six months old\" is 0.5 years, not 6) and understands the locale's words for a newborn; \"count\" reads spoken numerals; \"address\" and \"phone\" pull the value out of a sentence. Extraction that finds nothing leaves the caller's own words in place."
        },
        "expect": { "$ref": "#/$defs/expectation" },
        "next": {
          "type": "array",
          "description": "Conditional edges evaluated after this question is answered. If absent, flow continues to the next question in sequence.",
          "items": { "$ref": "#/$defs/edge" }
        }
      }
    },
    "expectation": {
      "type": "object",
      "required": ["type", "options"],
      "additionalProperties": false,
      "properties": {
        "type": { "const": "choice" },
        "options": {
          "type": "array",
          "minItems": 2,
          "items": {
            "type": "object",
            "required": ["id", "keywords"],
            "additionalProperties": false,
            "properties": {
              "id": { "type": "string" },
              "keywords": { "$ref": "#/$defs/localizedKeywords" }
            }
          }
        }
      }
    },
    "edge": {
      "type": "object",
      "additionalProperties": false,
      "oneOf": [{ "required": ["goto"] }, { "required": ["gotoProtocol"] }],
      "properties": {
        "whenOption": {
          "type": "string",
          "description": "Take this edge when this question's answered option id matches. An edge with neither whenOption nor when is the default."
        },
        "when": {
          "type": "array",
          "description": "v0.2: additional conditions on previously collected slots (choice options or numeric comparisons); all must hold. Edges are evaluated in order.",
          "items": { "$ref": "#/$defs/condition" },
          "minItems": 1
        },
        "goto": {
          "type": "string",
          "description": "A question id within the same protocol, or the sentinel '$determine' to proceed to determinant selection."
        },
        "gotoProtocol": {
          "type": "string",
          "description": "v0.2: jump to another protocol's key questions ('go to the C1 card'). The target protocol takes over the rest of the call, including determinants."
        }
      }
    },
    "condition": {
      "type": "object",
      "additionalProperties": false,
      "required": ["slot"],
      "oneOf": [
        { "required": ["option"] },
        {
          "anyOf": [
            { "required": ["gt"] },
            { "required": ["gte"] },
            { "required": ["lt"] },
            { "required": ["lte"] }
          ],
          "not": { "required": ["option"] }
        }
      ],
      "properties": {
        "slot": { "type": "string" },
        "option": { "type": "string", "description": "Matches when the slot's answered option id equals this." },
        "gt": { "type": "number" },
        "gte": { "type": "number" },
        "lt": { "type": "number" },
        "lte": { "type": "number" }
      },
      "description": "Choice condition ({slot, option}) or numeric condition ({slot, gt/gte/lt/lte}) on a slot whose question declares extract: 'number'. A numeric condition never matches when no number was captured."
    },
    "protocol": {
      "type": "object",
      "required": ["id", "name", "keywords", "keyQuestions", "determinants", "postDispatch"],
      "additionalProperties": false,
      "properties": {
        "id": { "type": "string" },
        "name": { "$ref": "#/$defs/localizedText" },
        "keywords": { "$ref": "#/$defs/localizedKeywords" },
        "keyQuestions": {
          "type": "array",
          "items": { "$ref": "#/$defs/question" }
        },
        "determinants": {
          "type": "array",
          "minItems": 1,
          "description": "Ordered rules; the first whose conditions all match wins. The final rule should omit 'when' as a default.",
          "items": {
            "type": "object",
            "required": ["id", "response"],
            "additionalProperties": false,
            "properties": {
              "id": { "type": "string" },
              "when": {
                "type": "array",
                "items": { "$ref": "#/$defs/condition" }
              },
              "response": {
                "type": "string",
                "description": "Neutral response level, e.g. BLS_COLD, ALS_COLD, ALS_HOT."
              }
            }
          }
        },
        "postDispatch": {
          "type": "array",
          "description": "stringIds of instructions read to the caller after responders are dispatched.",
          "items": { "type": "string" }
        },
        "postDispatchScripts": {
          "type": "array",
          "description": "v0.3: interactive instruction scripts to run after the postDispatch strings. Ordered; the first entry whose conditions all hold is the one that runs, so a card can route by age (infant / child / adult CPR) exactly as the printed cards do.",
          "items": {
            "type": "object",
            "required": ["script"],
            "additionalProperties": false,
            "properties": {
              "script": { "type": "string", "description": "An id in the pack's top-level scripts." },
              "when": {
                "type": "array",
                "items": { "$ref": "#/$defs/condition" },
                "minItems": 1
              }
            }
          }
        },
        "dispatcherNotes": {
          "type": "object",
          "description": "v0.3: content for the dispatcher, never spoken to the caller — the cards' 'Call Taker Prompts', 'Dispatcher Short Report' and 'Useful Information' sections. These stringIds must not appear anywhere the engine can speak them, and the loader rejects a pack that reuses one.",
          "additionalProperties": false,
          "minProperties": 1,
          "properties": {
            "prompts": { "type": "array", "items": { "type": "string" }, "minItems": 1 },
            "shortReport": { "type": "array", "items": { "type": "string" }, "minItems": 1 },
            "useful": { "type": "array", "items": { "type": "string" }, "minItems": 1 }
          }
        }
      }
    },
    "instructionScript": {
      "type": "object",
      "required": ["id", "name", "steps"],
      "additionalProperties": false,
      "properties": {
        "id": { "type": "string" },
        "name": { "$ref": "#/$defs/localizedText" },
        "source": { "type": "string", "description": "The card this script digitizes, e.g. 'I2: Adult CPR Instructions'." },
        "steps": {
          "type": "array",
          "minItems": 1,
          "items": { "$ref": "#/$defs/scriptStep" }
        }
      }
    },
    "scriptStep": {
      "type": "object",
      "required": ["id", "kind", "stringId"],
      "additionalProperties": false,
      "properties": {
        "id": { "type": "string" },
        "kind": {
          "enum": ["say", "ask", "stay"],
          "description": "'say' reads a line and moves on. 'ask' reads a line, captures the caller's answer into a slot, and branches. 'stay' reads a final line and holds the line — the script's terminal step ('keep doing it until help arrives; I will stay on the line')."
        },
        "stringId": { "type": "string" },
        "slot": { "type": "string", "pattern": "^[a-zA-Z][a-zA-Z0-9_]*$", "description": "Required for 'ask' steps; the slot the answer lands in." },
        "expect": { "$ref": "#/$defs/expectation" },
        "next": {
          "type": "array",
          "description": "Conditional edges evaluated after this step. Without a matching edge, flow continues to the next step in sequence. Forbidden on 'stay' steps.",
          "items": { "$ref": "#/$defs/scriptEdge" },
          "minItems": 1
        }
      },
      "allOf": [
        {
          "if": { "properties": { "kind": { "const": "ask" } }, "required": ["kind"] },
          "then": { "required": ["slot", "expect"] }
        },
        {
          "if": { "properties": { "kind": { "const": "stay" } }, "required": ["kind"] },
          "then": { "not": { "required": ["next"] } }
        }
      ]
    },
    "scriptEdge": {
      "type": "object",
      "additionalProperties": false,
      "oneOf": [{ "required": ["goto"] }, { "required": ["gotoScript"] }],
      "properties": {
        "whenOption": { "type": "string", "description": "Take this edge when this step's answered option id matches. An edge with neither whenOption nor when is the default." },
        "when": {
          "type": "array",
          "items": { "$ref": "#/$defs/condition" },
          "minItems": 1
        },
        "goto": { "type": "string", "description": "A step id within the same script, or the sentinel '$end' to finish the script." },
        "gotoScript": { "type": "string", "description": "Hand off to another script ('jump to I1: AED Instructions'). The target runs to its own end." }
      }
    }
  }
}
