{
  "schemaVersion": "0.1",
  "id": "us-nhtsa-emd",
  "name": {
    "en": "US — NHTSA EMD Curriculum (reference subset)",
    "es": "EE. UU. — Currículo EMD de la NHTSA (subconjunto de referencia)"
  },
  "jurisdiction": {
    "country": "US",
    "region": "Generic (federal curriculum, no specific PSAP)",
    "emergencyNumber": "911"
  },
  "provenance": {
    "source": "U.S. DOT / NHTSA, Emergency Medical Dispatch: National Standard Curriculum (public domain); heavily simplified reference subset for engine development",
    "url": "https://www.ems.gov/",
    "license": "public-domain",
    "digitizedDate": "2026-08-19",
    "notes": "NOT a complete or faithful protocol. Demonstrates the pack format: case entry, protocol selection, key-question branching, determinants, post-dispatch instructions, and bilingual catalogs. Never use for real call-taking or medical guidance."
  },
  "locales": ["en", "es"],
  "defaultLocale": "en",
  "caseEntry": [
    { "id": "q_address", "slot": "address", "stringId": "q_address" },
    { "id": "q_callback", "slot": "callback", "stringId": "q_callback" },
    { "id": "q_complaint", "slot": "complaint", "stringId": "q_complaint", "selectsProtocol": true },
    { "id": "q_age", "slot": "age", "stringId": "q_age" },
    {
      "id": "q_conscious",
      "slot": "conscious",
      "stringId": "q_conscious",
      "expect": {
        "type": "choice",
        "options": [
          { "id": "no", "keywords": { "en": ["no", "unconscious", "passed out"], "es": ["no", "inconsciente", "desmayado"] } },
          { "id": "yes", "keywords": { "en": ["yes", "yeah", "awake"], "es": ["sí", "si", "despierto"] } }
        ]
      }
    },
    {
      "id": "q_breathing",
      "slot": "breathing",
      "stringId": "q_breathing",
      "expect": {
        "type": "choice",
        "options": [
          { "id": "no", "keywords": { "en": ["no", "not breathing"], "es": ["no"] } },
          { "id": "yes", "keywords": { "en": ["yes", "yeah", "breathing"], "es": ["sí", "si", "respira"] } }
        ]
      },
      "next": [{ "whenOption": "no", "goto": "$determine" }]
    }
  ],
  "protocols": [
    {
      "id": "chest_pain",
      "name": { "en": "Chest Pain", "es": "Dolor de pecho" },
      "keywords": {
        "en": ["chest pain", "chest hurts", "heart attack", "chest pressure"],
        "es": ["dolor de pecho", "pecho", "infarto"]
      },
      "keyQuestions": [
        {
          "id": "kq_cp_alert",
          "slot": "cp_alert",
          "stringId": "kq_cp_alert",
          "expect": {
            "type": "choice",
            "options": [
              { "id": "no", "keywords": { "en": ["no", "confused", "out of it"], "es": ["no", "confundido"] } },
              { "id": "yes", "keywords": { "en": ["yes", "yeah", "alert"], "es": ["sí", "si", "alerta"] } }
            ]
          },
          "next": [
            { "whenOption": "no", "goto": "$determine" },
            { "goto": "kq_cp_clammy" }
          ]
        },
        {
          "id": "kq_cp_clammy",
          "slot": "cp_clammy",
          "stringId": "kq_cp_clammy",
          "expect": {
            "type": "choice",
            "options": [
              { "id": "no", "keywords": { "en": ["no", "dry"], "es": ["no", "seca"] } },
              { "id": "yes", "keywords": { "en": ["yes", "yeah", "sweaty", "pale", "clammy"], "es": ["sí", "si", "sudoroso", "pálido", "palido"] } }
            ]
          }
        }
      ],
      "determinants": [
        { "id": "cp_not_alert", "when": [{ "slot": "cp_alert", "option": "no" }], "response": "ALS_HOT" },
        { "id": "cp_clammy", "when": [{ "slot": "cp_clammy", "option": "yes" }], "response": "ALS_HOT" },
        { "id": "cp_default", "response": "ALS_COLD" }
      ],
      "postDispatch": ["pd_rest", "pd_nothing_by_mouth", "pd_callback_worse"]
    },
    {
      "id": "unconscious_fainting",
      "name": { "en": "Unconscious / Fainting", "es": "Inconsciente / Desmayo" },
      "keywords": {
        "en": ["unconscious", "passed out", "fainted", "not waking"],
        "es": ["inconsciente", "desmayado", "desmayo", "no despierta"]
      },
      "keyQuestions": [
        {
          "id": "kq_unc_breathing",
          "slot": "unc_breathing",
          "stringId": "kq_unc_breathing",
          "expect": {
            "type": "choice",
            "options": [
              { "id": "no", "keywords": { "en": ["no", "not breathing", "gasping"], "es": ["no", "jadeando"] } },
              { "id": "yes", "keywords": { "en": ["yes", "yeah", "breathing"], "es": ["sí", "si", "respira"] } }
            ]
          },
          "next": [{ "whenOption": "no", "goto": "$determine" }]
        }
      ],
      "determinants": [
        { "id": "unc_not_breathing", "when": [{ "slot": "unc_breathing", "option": "no" }], "response": "ALS_HOT" },
        { "id": "unc_default", "response": "ALS_HOT" }
      ],
      "postDispatch": ["pd_dont_move", "pd_watch_breathing", "pd_callback_worse"]
    },
    {
      "id": "general_medical",
      "name": { "en": "General Medical (fallback)", "es": "Médico general (por defecto)" },
      "keywords": { "en": ["sick"], "es": ["enfermo"] },
      "keyQuestions": [],
      "determinants": [{ "id": "gm_default", "response": "BLS_COLD" }],
      "postDispatch": ["pd_callback_worse"]
    }
  ],
  "fallbackProtocol": "general_medical",
  "strings": {
    "en": {
      "greeting": "Nine-one-one.",
      "q_address": "What is the address of the emergency?",
      "q_callback": "What is the phone number you are calling from?",
      "q_complaint": "Okay, tell me exactly what happened.",
      "q_age": "How old is the patient?",
      "q_conscious": "Is the patient conscious?",
      "q_breathing": "Is the patient breathing?",
      "kq_cp_alert": "Is the patient completely alert and able to speak to you normally?",
      "kq_cp_clammy": "Is the patient pale, sweaty, or clammy?",
      "kq_unc_breathing": "Watch the chest closely — is the patient breathing normally right now?",
      "dispatch_confirm": "Help is on the way to {address}. Stay on the line.",
      "pd_rest": "Help the patient into a comfortable position and do not let them walk around.",
      "pd_nothing_by_mouth": "Do not give the patient anything to eat or drink.",
      "pd_dont_move": "Do not move the patient unless they are in danger.",
      "pd_watch_breathing": "Stay with the patient and watch their breathing closely.",
      "pd_callback_worse": "If anything changes or gets worse, call back immediately.",
      "closing": "Responders are on the way. I am going to let you go now."
    },
    "es": {
      "greeting": "Nueve-uno-uno.",
      "q_address": "¿Cuál es la dirección de la emergencia?",
      "q_callback": "¿Cuál es el número de teléfono desde el que llama?",
      "q_complaint": "Bien, dígame exactamente qué pasó.",
      "q_age": "¿Qué edad tiene el paciente?",
      "q_conscious": "¿Está consciente el paciente?",
      "q_breathing": "¿Está respirando el paciente?",
      "kq_cp_alert": "¿Está el paciente completamente alerta y puede hablarle con normalidad?",
      "kq_cp_clammy": "¿Está el paciente pálido, sudoroso o con la piel fría?",
      "kq_unc_breathing": "Observe el pecho con atención: ¿está respirando normalmente en este momento?",
      "dispatch_confirm": "La ayuda va en camino a {address}. Permanezca en la línea.",
      "pd_rest": "Ayude al paciente a ponerse en una posición cómoda y no permita que camine.",
      "pd_nothing_by_mouth": "No le dé nada de comer ni de beber.",
      "pd_dont_move": "No mueva al paciente a menos que esté en peligro.",
      "pd_watch_breathing": "Quédese con el paciente y vigile su respiración de cerca.",
      "pd_callback_worse": "Si algo cambia o empeora, llame de inmediato.",
      "closing": "Los servicios de emergencia van en camino. Voy a terminar la llamada ahora."
    }
  }
}
